{
  "schema_version": "1.0",
  "id": "restricted-core",
  "name": "Restricted core",
  "bounds": {
    "minimum": [
      0,
      0,
      0
    ],
    "maximum": [
      100,
      100,
      60
    ]
  },
  "start": [
    7,
    50,
    8
  ],
  "goal": [
    93,
    50,
    8
  ],
  "drone_radius": 1.0,
  "safety_margin": 1.0,
  "buildings": [
    {
      "id": "north-west",
      "minimum": [
        15,
        55,
        0.0
      ],
      "maximum": [
        37,
        79,
        30
      ]
    },
    {
      "id": "north-east",
      "minimum": [
        65,
        58,
        0.0
      ],
      "maximum": [
        85,
        84,
        34
      ]
    },
    {
      "id": "south-west",
      "minimum": [
        18,
        15,
        0.0
      ],
      "maximum": [
        36,
        38,
        25
      ]
    },
    {
      "id": "south-east",
      "minimum": [
        66,
        16,
        0.0
      ],
      "maximum": [
        86,
        38,
        40
      ]
    },
    {
      "id": "core-a",
      "minimum": [
        42,
        31,
        0.0
      ],
      "maximum": [
        54,
        45,
        18
      ]
    },
    {
      "id": "core-b",
      "minimum": [
        48,
        63,
        0.0
      ],
      "maximum": [
        61,
        78,
        22
      ]
    }
  ],
  "no_fly_zones": [
    {
      "id": "nfz-central",
      "center": [
        52,
        50
      ],
      "radius": 15,
      "z_min": 0,
      "z_max": 55
    }
  ],
  "metadata": {
    "family": "curated",
    "description": "Central full-height no-fly zone."
  }
}
